{
  "$schema": "../../donation_contract_v1.1.json",
  "schema_version": "1.1",
  "donation_version": "1.1.0",
  "handler_domain": "translation",
  "intent_name_patterns": [
    "translation.translate",
    "translation.specific",
    "llm.translate"
  ],
  "domain_patterns": [
    "translation",
    "language",
    "llm"
  ],
  "method_donations": [
    {
      "method_name": "_handle_translate_text",
      "intent_suffix": "translate",
      "boost": 1.3,
      "room_context": "none",
      "parameters": [
        {
          "name": "text",
          "type": "string",
          "required": false,
          "entity_type": "generic"
        },
        {
          "name": "target_language",
          "type": "entity",
          "required": false,
          "entity_type": "generic"
        }
      ]
    },
    {
      "method_name": "_handle_translate_specific",
      "intent_suffix": "specific",
      "boost": 1.4,
      "room_context": "none",
      "parameters": [
        {
          "name": "text",
          "type": "string",
          "required": true,
          "entity_type": "generic"
        },
        {
          "name": "target_language",
          "type": "entity",
          "required": true,
          "entity_type": "generic"
        }
      ]
    }
  ],
  "global_parameters": [
    {
      "name": "language",
      "type": "choice",
      "required": false,
      "choices": [
        "ru",
        "en"
      ],
      "entity_type": "generic"
    }
  ]
}
