{
  "$schema": "../../donation_contract_v1.1.json",
  "schema_version": "1.1",
  "donation_version": "1.1.0",
  "handler_domain": "train_schedule",
  "intent_name_patterns": [
    "transport.train_schedule",
    "transport.get_trains"
  ],
  "method_donations": [
    {
      "method_name": "handle_train_query",
      "intent_suffix": "query",
      "boost": 1.2,
      "room_context": "none",
      "parameters": [
        {
          "name": "from_station",
          "type": "string",
          "required": false,
          "entity_type": "generic"
        },
        {
          "name": "to_station",
          "type": "string",
          "required": false,
          "entity_type": "generic"
        },
        {
          "name": "time",
          "type": "string",
          "required": false,
          "entity_type": "generic"
        }
      ]
    }
  ],
  "global_parameters": [
    {
      "name": "language",
      "type": "choice",
      "required": false,
      "choices": [
        "ru",
        "en"
      ],
      "entity_type": "generic"
    }
  ]
}
