{
  "$schema": "../../donation_contract_v1.1.json",
  "schema_version": "1.1",
  "donation_version": "1.1.0",
  "handler_domain": "provider_control",
  "intent_name_patterns": [
    "provider.switch",
    "provider.list",
    "provider.control"
  ],
  "domain_patterns": [
    "provider",
    "control",
    "management"
  ],
  "method_donations": [
    {
      "method_name": "_handle_switch_provider",
      "intent_suffix": "switch",
      "boost": 1.3,
      "room_context": "none",
      "parameters": [
        {
          "name": "component",
          "type": "choice",
          "required": false,
          "choices": [
            "audio",
            "llm",
            "asr",
            "tts"
          ],
          "entity_type": "generic"
        },
        {
          "name": "provider",
          "type": "string",
          "required": false,
          "entity_type": "generic"
        }
      ]
    },
    {
      "method_name": "_handle_list_providers",
      "intent_suffix": "list",
      "boost": 1.2,
      "room_context": "none",
      "parameters": [
        {
          "name": "component",
          "type": "choice",
          "required": false,
          "choices": [
            "audio",
            "llm",
            "asr",
            "tts",
            "all"
          ],
          "entity_type": "generic"
        }
      ]
    }
  ],
  "global_parameters": [
    {
      "name": "language",
      "type": "choice",
      "required": false,
      "choices": [
        "ru",
        "en"
      ],
      "entity_type": "generic"
    }
  ]
}
